[
  {
    "eval_sample": {
      "user_input": "What is the definition of 中国平安 in the context provided?",
      "retrieved_contexts": null,
      "reference_contexts": [
        "释  义 \n4 \n \n平安银行股份有限公司 \n2022 年年度报告 \n释  义 \n \n释义项 指 释义内容 \n平安银行、本行 指 \n深圳发展银行股份有限公司（“深圳发展银行”或“深发展”）以吸\n收合并原平安银行股份有限公司（“原平安银行”）的方式于 2012\n年完成两行整合并更名后的银行 \n本集团 指 平安银行股份有限公司及其全资子公司平安理财有限责任公司 \n深圳发展银行、深发展 指 \n成立于 1987 年 12 月22 日的全国性股份制商业银行， 吸收合并原平安\n银行后更名为平安银行 \n原平安银行 指 成立于 1995 年 6 月的股份制商业银行， 于2012 年6 月12 日注销登记 \n中国平安、平安集团 指 中国平安保险（集团）股份有限公司 \n平安理财 指 平安理财有限责任公司 \n平安寿险 指 中国平安人寿保险股份有限公司 \n央行 指 中国人民银行 \n中国证监会、证监会 指 中国证券监督管理委员会 \n中国银保监会、银保监会 指 中国银行保险监督管理委员会 "
      ],
      "retrieved_context_ids": null,
      "reference_context_ids": null,
      "response": null,
      "multi_responses": null,
      "reference": "中国平安, also referred to as 平安集团, is the China Ping An Insurance (Group) Co., Ltd.",
      "rubrics": null
    },
    "synthesizer_name": "single_hop_specific_query_synthesizer"
  },
  {
    "eval_sample": {
      "user_input": "平安银行如何通过高质量发展支持经济的可持续增长？",
      "retrieved_contexts": null,
      "reference_contexts": [
        "<1-hop>\n\n释  义 \n4 \n \n平安银行股份有限公司 \n2022 年年度报告 \n释  义 \n \n释义项 指 释义内容 \n平安银行、本行 指 \n深圳发展银行股份有限公司（“深圳发展银行”或“深发展”）以吸\n收合并原平安银行股份有限公司（“原平安银行”）的方式于 2012\n年完成两行整合并更名后的银行 \n本集团 指 平安银行股份有限公司及其全资子公司平安理财有限责任公司 \n深圳发展银行、深发展 指 \n成立于 1987 年 12 月22 日的全国性股份制商业银行， 吸收合并原平安\n银行后更名为平安银行 \n原平安银行 指 成立于 1995 年 6 月的股份制商业银行， 于2012 年6 月12 日注销登记 \n中国平安、平安集团 指 中国平安保险（集团）股份有限公司 \n平安理财 指 平安理财有限责任公司 \n平安寿险 指 中国平安人寿保险股份有限公司 \n央行 指 中国人民银行 \n中国证监会、证监会 指 中国证券监督管理委员会 \n中国银保监会、银保监会 指 中国银行保险监督管理委员会 ",
        "<2-hop>\n\n董事长致辞 \n5 \n \n平安银行股份有限公司 \n2022 年年度报告 \n董事长致辞 \n坚持高质量发展之路，股份制银行大有可为 \n党的二十大报告强调，要加快构建新发展格局、着力推动高质量发展。新发展格局下，我国 要\n牢牢把握扩大内需这一战略基点，国民经济循环正在深度重构。高质量发展要求下，经济的高质量\n发展是其中的重要组成，金融作为实体经济血脉，理应有更大更新的作为。 \n过去由于信用体系不完善，科技手段欠发达，金融机构出于风险、成本等方面的考虑，一定程\n度上出现了金融供给结构性失衡的情况。在企业端，有实力、有抵押的企业主体拥有丰富的金融资\n源，成长型企业、中小微企业普遍面临融资难、融资贵问题；在居民端，银行将有限的经营资源、\n服务能力用于高价值客户，对大众长尾客群的服务普遍缺失。 \n在新发展格局下，要增强国内大循环的内生动力和可靠性，金融机构必须找准经济发展的重点\n领域和薄弱环节，通过金融供给侧改革，支持经济的高质量发展。股份制银行也应结合自身敏捷、\n创新、市场化的禀赋，迎难而上，为高质量发展作出更大的贡献和突破。"
      ],
      "retrieved_context_ids": null,
      "reference_context_ids": null,
      "response": null,
      "multi_responses": null,
      "reference": "平安银行通过坚持高质量发展之路，结合自身敏捷、创新、市场化的禀赋，在新发展格局下增强国内大循环的内生动力和可靠性。通过金融供给侧改革，支持经济的高质量发展，特别是在企业端和居民端提供更广泛的金融服务，解决融资难、融资贵问题以及服务大众长尾客群的缺失问题。",
      "rubrics": null
    },
    "synthesizer_name": "multi_hop_abstract_query_synthesizer"
  }
]